{
  "contract": "sley2-benchmark-plan-v1",
  "status": "FROZEN_DESIGN",
  "corpus_version": 1,
  "task_manifest": "corpus/v1/tasks.json",
  "not_program_input": true,
  "arms": [
    {"id": "raw_files", "required": true, "fixture_status": "PENDING"},
    {
      "id": "sley_1_2_0",
      "required": true,
      "fixture_status": "FROZEN_LEGACY_ARTIFACT",
      "commit": "397fa28ded15ddbeca5404ee00a3f5bd5546b296",
      "artifact_sha256": "b24f19c6a348751c93c9cf63f6f4154f6132796112c26f9d8c0e71324080dbc7"
    },
    {"id": "sley_2_0", "required": true, "fixture_status": "PENDING"},
    {"id": "zerolang", "required": false, "fixture_status": "UNESTABLISHED"}
  ],
  "run_freeze_required_fields": [
    "corpus_digest",
    "arm_fixture_digests",
    "task_statement_digest",
    "model_provider",
    "model_exact_version",
    "model_configuration",
    "tool_description_digests",
    "context_budget",
    "action_budget",
    "wall_time_budget",
    "retry_policy",
    "hardware_manifest",
    "cache_state",
    "oracle_digest",
    "trial_count",
    "random_seeds",
    "environment_manifest"
  ],
  "metrics": [
    "strict_accepted_correctness",
    "attempted_tasks",
    "accepted_correct_changes",
    "invalid_candidates",
    "invalid_committed_states",
    "stale_candidates",
    "stale_candidates_incorrectly_accepted",
    "collateral_semantic_changes",
    "model_input_tokens",
    "model_output_tokens",
    "total_observable_tokens",
    "accepted_change_tokens",
    "context_bytes",
    "entities_inspected",
    "relationships_inspected",
    "files_inspected",
    "tool_calls",
    "compile_or_check_attempts",
    "repair_loops",
    "wall_time",
    "peak_memory",
    "canonical_storage_bytes",
    "pack_bytes",
    "execution_latency",
    "human_interventions"
  ],
  "fairness_invariants": [
    "same_task_intent",
    "same_strict_semantic_oracle",
    "same_model_and_exact_version",
    "same_model_configuration",
    "same_context_action_and_wall_budgets",
    "same_retry_policy",
    "same_hardware_and_cache_policy",
    "equivalent_protocol_or_tool_training_material",
    "no_arm_specific_prompt_rewording",
    "no_post_failure_hand_repair",
    "no_removed_timeout_or_failure",
    "no_task_selected_for_one_arm_strength"
  ],
  "failure_retention": {
    "every_attempt_in_denominator": true,
    "timeouts_are_failures": true,
    "invalid_commits_are_failures": true,
    "raw_prompts_outputs_tool_calls_candidates_roots_receipts_reports_and_environment_preserved": true
  },
  "thresholds": {
    "critical_class_correctness_not_lower_than_legacy": true,
    "failure_rate_relative_reduction_percent_or_equal_correctness_act_reduction_percent": [20, 30],
    "median_context_bytes_reduction_percent_or_model_input_tokens_reduction_percent": [40, 30],
    "other_context_metric_max_regression_percent": 10,
    "median_repair_loop_reduction_percent_or_accepted_changes_increase_percent": [25, 20],
    "invalid_candidates_leave_state_unchanged_percent": 100,
    "stale_preconditions_rejected_percent": 100,
    "invalid_committed_states": 0,
    "stale_conflicting_candidates_accepted": 0,
    "human_interventions_sley2": 0
  },
  "mutation_rule": "Corpus v1 is append-protected after its first trial manifest. Any semantic task or oracle change creates a new corpus version and preserves v1."
}
